{
  "snapshotId": "11111111-1111-1111-1111-111111111111",
  "sessionId": "22222222-2222-2222-2222-222222222222",
  "generation": 1,
  "captureRequestId": "33333333-3333-3333-3333-333333333333",
  "formatId": "claude-code-fs",
  "formatVersion": "1",
  "adapterVersion": "2026.08.01",
  "syncedThroughSeq": 42,
  "contentType": "application/octet-stream",
  "sha256": "aaaaaaaaaaaaaaaaaaaaaaaaaaaaaaaaaaaaaaaaaaaaaaaaaaaaaaaaaaaaaaaa",
  "sizeBytes": 1048576,
  "createdAt": "2026-08-03T00:00:00Z"
}
